{
  "schema_version": "1.0.0",
  "project_id": "sensitive-admin",
  "screen_id": "record-delete",
  "selection_status": "selected",
  "catalog_component_count": 36,
  "interaction_pattern_count": 24,
  "screen_composition_count": 20,
  "journey_pattern_count": 18,
  "selected_components": [
    {
      "standard_id": "VCGF-UI-COMP-012",
      "decision": "required",
      "matched_signals": [
        "permission_sensitive_actions"
      ],
      "implementation_action": "build_new",
      "standard_path": "standards/VCGF-UI-COMP-012-PermissionAwareActions.md",
      "review_relationships": [
        "VCGF-UI-COMP-001",
        "VCGF-UI-COMP-007",
        "VCGF-UI-COMP-008"
      ],
      "reason": "Explicit component capability signals matched; relationships are review-only."
    },
    {
      "standard_id": "VCGF-UI-COMP-025",
      "decision": "required",
      "matched_signals": [
        "record_detail"
      ],
      "implementation_action": "build_new",
      "standard_path": "standards/VCGF-UI-COMP-025-SmartRecordDetailView.md",
      "review_relationships": [
        "VCGF-UI-COMP-001",
        "VCGF-UI-COMP-003",
        "VCGF-UI-COMP-008",
        "VCGF-UI-COMP-012",
        "VCGF-UI-COMP-024"
      ],
      "reason": "Explicit component capability signals matched; relationships are review-only."
    },
    {
      "standard_id": "VCGF-UI-COMP-031",
      "decision": "required",
      "matched_signals": [
        "contextual_actions"
      ],
      "implementation_action": "build_new",
      "standard_path": "standards/VCGF-UI-COMP-031-SmartContextualActionBar.md",
      "review_relationships": [
        "VCGF-UI-COMP-001",
        "VCGF-UI-COMP-007",
        "VCGF-UI-COMP-008",
        "VCGF-UI-COMP-012"
      ],
      "reason": "Explicit component capability signals matched; relationships are review-only."
    }
  ],
  "selected_interactions": [
    {
      "standard_id": "VCGF-UI-INT-004",
      "decision": "required",
      "matched_signals": [
        "delete_record"
      ],
      "implementation_action": "build_new",
      "standard_path": "interactions/VCGF-UI-INT-004-SafeDeleteFlow.md",
      "review_components": [
        "VCGF-UI-COMP-012",
        "VCGF-UI-COMP-031",
        "VCGF-UI-COMP-008",
        "VCGF-UI-COMP-016"
      ],
      "reason": "Explicit interaction-state/risk signals matched; no cross-layer auto-activation."
    },
    {
      "standard_id": "VCGF-UI-INT-007",
      "decision": "recommended",
      "matched_signals": [
        "confirmation_needed"
      ],
      "implementation_action": "build_new",
      "standard_path": "interactions/VCGF-UI-INT-007-ConfirmationDecisionPattern.md",
      "review_components": [
        "VCGF-UI-COMP-007",
        "VCGF-UI-COMP-012",
        "VCGF-UI-COMP-008"
      ],
      "reason": "Explicit interaction-state/risk signals matched; no cross-layer auto-activation."
    },
    {
      "standard_id": "VCGF-UI-INT-018",
      "decision": "required",
      "matched_signals": [
        "step_up_required"
      ],
      "implementation_action": "build_new",
      "standard_path": "interactions/VCGF-UI-INT-018-SensitiveActionStepUp.md",
      "review_components": [
        "VCGF-UI-COMP-036",
        "VCGF-UI-COMP-012",
        "VCGF-UI-COMP-007"
      ],
      "reason": "Explicit interaction-state/risk signals matched; no cross-layer auto-activation."
    }
  ],
  "selected_screen_compositions": [
    {
      "standard_id": "VCGF-UI-SCR-003",
      "kind": "primary",
      "decision": "required",
      "matched_signals": [
        "record_workspace"
      ],
      "implementation_action": "build_new",
      "standard_path": "screen-compositions/VCGF-UI-SCR-003-RecordWorkspace.md",
      "review_components": [
        "VCGF-UI-COMP-025",
        "VCGF-UI-COMP-031",
        "VCGF-UI-COMP-027",
        "VCGF-UI-COMP-028"
      ],
      "review_interactions": [
        "VCGF-UI-INT-003",
        "VCGF-UI-INT-024",
        "VCGF-UI-INT-017"
      ],
      "reason": "Highest explicit composition evidence; other layers remain independent."
    }
  ],
  "selected_journeys": [],
  "external_standards": [],
  "compatibility_reviews": [
    {
      "left": "VCGF-UI-COMP-012",
      "right": "VCGF-UI-COMP-031",
      "relation_type": "complementary",
      "severity": "info",
      "rule": "PermissionAwareActions يملك قواعد الإجراء؛ ContextualActionBar يملك ترتيب وعرض الإجراءات في السياق."
    }
  ],
  "interaction_reviews": [
    {
      "left": "VCGF-UI-INT-004",
      "right": "VCGF-UI-INT-007",
      "relation_type": "complementary",
      "severity": "info",
      "rule": "الحذف عالي الخطورة قد يحتاج تأكيدًا؛ الحذف القابل للتراجع منخفض المخاطر قد يستخدم Undo بدل حوار ثقيل."
    }
  ],
  "composition_reviews": [],
  "journey_reviews": [],
  "standards_to_load": [
    "standards/VCGF-UI-COMP-012-PermissionAwareActions.md",
    "standards/VCGF-UI-COMP-025-SmartRecordDetailView.md",
    "standards/VCGF-UI-COMP-031-SmartContextualActionBar.md",
    "interactions/VCGF-UI-INT-004-SafeDeleteFlow.md",
    "interactions/VCGF-UI-INT-007-ConfirmationDecisionPattern.md",
    "interactions/VCGF-UI-INT-018-SensitiveActionStepUp.md",
    "screen-compositions/VCGF-UI-SCR-003-RecordWorkspace.md"
  ],
  "not_selected_component_count": 33,
  "not_selected_interaction_count": 21,
  "not_selected_screen_composition_count": 19,
  "not_selected_journey_count": 18,
  "composition_status": "selected",
  "journey_status": "not_selected",
  "orchestration": {
    "primary_composition_id": "VCGF-UI-SCR-003",
    "modifier_ids": [],
    "density_policy": "adaptive",
    "responsive_strategy": "task-preserving-adaptive",
    "mobile_transform": "task-preserving-reflow",
    "large_screen_transform": "context-expansion",
    "primary_action_limit": 1,
    "progressive_disclosure": true,
    "role_adaptation": "priority-only",
    "preserve_task_context": true
  },
  "experience_orchestration": null,
  "warnings": []
}
