{
  "schema_version": "1.0.0",
  "project_id": "example-presentation",
  "screen_id": "records",
  "selection_status": "selected",
  "catalog_component_count": 36,
  "interaction_pattern_count": 24,
  "screen_composition_count": 20,
  "journey_pattern_count": 18,
  "selected_components": [
    {
      "standard_id": "VCGF-UI-COMP-002",
      "decision": "required",
      "matched_signals": [
        "tabular_operational_data"
      ],
      "implementation_action": "build_new",
      "standard_path": "standards/VCGF-UI-COMP-002-SmartDataGrid.md",
      "review_relationships": [
        "VCGF-UI-COMP-001",
        "VCGF-UI-COMP-004",
        "VCGF-UI-COMP-008",
        "VCGF-UI-COMP-012"
      ],
      "reason": "Explicit component capability signals matched; relationships are review-only."
    },
    {
      "standard_id": "VCGF-UI-COMP-026",
      "decision": "required",
      "matched_signals": [
        "collection_list"
      ],
      "implementation_action": "build_new",
      "standard_path": "standards/VCGF-UI-COMP-026-SmartCollectionList.md",
      "review_relationships": [
        "VCGF-UI-COMP-001",
        "VCGF-UI-COMP-008",
        "VCGF-UI-COMP-012",
        "VCGF-UI-COMP-024"
      ],
      "reason": "Explicit component capability signals matched; relationships are review-only."
    }
  ],
  "selected_interactions": [
    {
      "standard_id": "VCGF-UI-INT-021",
      "decision": "recommended",
      "matched_signals": [
        "search_results"
      ],
      "implementation_action": "build_new",
      "standard_path": "interactions/VCGF-UI-INT-021-SearchFilterResultState.md",
      "review_components": [
        "VCGF-UI-COMP-004",
        "VCGF-UI-COMP-014",
        "VCGF-UI-COMP-030",
        "VCGF-UI-COMP-026"
      ],
      "reason": "Explicit interaction-state/risk signals matched; no cross-layer auto-activation."
    },
    {
      "standard_id": "VCGF-UI-INT-024",
      "decision": "recommended",
      "matched_signals": [
        "preserve_navigation_context"
      ],
      "implementation_action": "build_new",
      "standard_path": "interactions/VCGF-UI-INT-024-NavigationContextPreservation.md",
      "review_components": [
        "VCGF-UI-COMP-009",
        "VCGF-UI-COMP-024",
        "VCGF-UI-COMP-025",
        "VCGF-UI-COMP-030"
      ],
      "reason": "Explicit interaction-state/risk signals matched; no cross-layer auto-activation."
    }
  ],
  "selected_screen_compositions": [
    {
      "standard_id": "VCGF-UI-SCR-002",
      "kind": "primary",
      "decision": "required",
      "matched_signals": [
        "collection_management"
      ],
      "implementation_action": "build_new",
      "standard_path": "screen-compositions/VCGF-UI-SCR-002-OperationalCollection.md",
      "review_components": [
        "VCGF-UI-COMP-002",
        "VCGF-UI-COMP-026",
        "VCGF-UI-COMP-004",
        "VCGF-UI-COMP-031"
      ],
      "review_interactions": [
        "VCGF-UI-INT-013",
        "VCGF-UI-INT-021",
        "VCGF-UI-INT-024"
      ],
      "reason": "Highest explicit composition evidence; other layers remain independent."
    }
  ],
  "selected_journeys": [],
  "external_standards": [],
  "compatibility_reviews": [
    {
      "left": "VCGF-UI-COMP-002",
      "right": "VCGF-UI-COMP-026",
      "relation_type": "alternative",
      "severity": "review",
      "rule": "كلاهما يعرض مجموعة سجلات. اختر الجدول للمقارنة العمودية والعمليات الكثيفة، والقائمة/البطاقات للمسح البصري والسياق. الجمع مسموح فقط كتبديل View موثق."
    }
  ],
  "interaction_reviews": [
    {
      "left": "VCGF-UI-INT-021",
      "right": "VCGF-UI-INT-024",
      "relation_type": "complementary",
      "severity": "info",
      "rule": "العودة من التفاصيل إلى النتائج تستعيد query والمرشحات فقط بعد التحقق من صلاحيتها."
    }
  ],
  "composition_reviews": [],
  "journey_reviews": [],
  "standards_to_load": [
    "standards/VCGF-UI-COMP-002-SmartDataGrid.md",
    "standards/VCGF-UI-COMP-026-SmartCollectionList.md",
    "interactions/VCGF-UI-INT-021-SearchFilterResultState.md",
    "interactions/VCGF-UI-INT-024-NavigationContextPreservation.md",
    "screen-compositions/VCGF-UI-SCR-002-OperationalCollection.md"
  ],
  "not_selected_component_count": 34,
  "not_selected_interaction_count": 22,
  "not_selected_screen_composition_count": 19,
  "not_selected_journey_count": 18,
  "composition_status": "selected",
  "journey_status": "not_selected",
  "orchestration": {
    "primary_composition_id": "VCGF-UI-SCR-002",
    "modifier_ids": [],
    "density_policy": "adaptive",
    "responsive_strategy": "task-preserving-adaptive",
    "mobile_transform": "task-preserving-reflow",
    "large_screen_transform": "context-expansion",
    "primary_action_limit": 1,
    "progressive_disclosure": true,
    "role_adaptation": "priority-only",
    "preserve_task_context": true
  },
  "experience_orchestration": null,
  "warnings": []
}
