{
  "schema_version": "1.0.0",
  "project_id": "demo",
  "screen_id": "public-request",
  "selection_status": "selected",
  "catalog_component_count": 36,
  "interaction_pattern_count": 24,
  "screen_composition_count": 20,
  "journey_pattern_count": 18,
  "selected_components": [
    {
      "standard_id": "VCGF-UI-COMP-003",
      "decision": "required",
      "matched_signals": [
        "form_create_edit"
      ],
      "implementation_action": "build_new",
      "standard_path": "standards/VCGF-UI-COMP-003-SmartFormFields.md",
      "review_relationships": [
        "VCGF-UI-COMP-001",
        "VCGF-UI-COMP-008",
        "VCGF-UI-COMP-012"
      ],
      "reason": "Explicit component capability signals matched; relationships are review-only."
    },
    {
      "standard_id": "VCGF-UI-COMP-008",
      "decision": "required",
      "matched_signals": [
        "system_notifications"
      ],
      "implementation_action": "build_new",
      "standard_path": "standards/VCGF-UI-COMP-008-UnifiedFeedbackSystem.md",
      "review_relationships": [
        "VCGF-UI-COMP-001"
      ],
      "reason": "Explicit component capability signals matched; relationships are review-only."
    }
  ],
  "selected_interactions": [
    {
      "standard_id": "VCGF-UI-INT-001",
      "decision": "required",
      "matched_signals": [
        "record_create"
      ],
      "implementation_action": "build_new",
      "standard_path": "interactions/VCGF-UI-INT-001-SmartCreateFlow.md",
      "review_components": [
        "VCGF-UI-COMP-003",
        "VCGF-UI-COMP-008",
        "VCGF-UI-COMP-012",
        "VCGF-UI-COMP-023"
      ],
      "reason": "Explicit interaction-state/risk signals matched; no cross-layer auto-activation."
    },
    {
      "standard_id": "VCGF-UI-INT-005",
      "decision": "required",
      "matched_signals": [
        "navigation_with_edits"
      ],
      "implementation_action": "build_new",
      "standard_path": "interactions/VCGF-UI-INT-005-UnsavedChangesProtection.md",
      "review_components": [
        "VCGF-UI-COMP-003",
        "VCGF-UI-COMP-023",
        "VCGF-UI-COMP-009"
      ],
      "reason": "Explicit interaction-state/risk signals matched; no cross-layer auto-activation."
    },
    {
      "standard_id": "VCGF-UI-INT-006",
      "decision": "required",
      "matched_signals": [
        "save_submit"
      ],
      "implementation_action": "build_new",
      "standard_path": "interactions/VCGF-UI-INT-006-SaveSubmitStateMachine.md",
      "review_components": [
        "VCGF-UI-COMP-003",
        "VCGF-UI-COMP-011",
        "VCGF-UI-COMP-015",
        "VCGF-UI-COMP-023"
      ],
      "reason": "Explicit interaction-state/risk signals matched; no cross-layer auto-activation."
    }
  ],
  "selected_screen_compositions": [
    {
      "standard_id": "VCGF-UI-SCR-018",
      "kind": "primary",
      "decision": "required",
      "matched_signals": [
        "public_self_service"
      ],
      "implementation_action": "build_new",
      "standard_path": "screen-compositions/VCGF-UI-SCR-018-PublicSelfService.md",
      "review_components": [
        "VCGF-UI-COMP-003",
        "VCGF-UI-COMP-011",
        "VCGF-UI-COMP-008",
        "VCGF-UI-COMP-018"
      ],
      "review_interactions": [
        "VCGF-UI-INT-001",
        "VCGF-UI-INT-005",
        "VCGF-UI-INT-023",
        "VCGF-UI-INT-010"
      ],
      "reason": "Highest explicit composition evidence; other layers remain independent."
    },
    {
      "standard_id": "VCGF-UI-SCR-019",
      "kind": "modifier",
      "decision": "recommended",
      "matched_signals": [
        "mobile_focused_task"
      ],
      "implementation_action": "build_new",
      "standard_path": "screen-compositions/VCGF-UI-SCR-019-MobileFocusedTask.md",
      "review_components": [
        "VCGF-UI-COMP-009",
        "VCGF-UI-COMP-008"
      ],
      "review_interactions": [
        "VCGF-UI-INT-015",
        "VCGF-UI-INT-024"
      ],
      "reason": "Explicit adaptive modifier signal matched."
    }
  ],
  "selected_journeys": [
    {
      "standard_id": "VCGF-UI-JRN-011",
      "decision": "required",
      "matched_signals": [
        "public_submit_track"
      ],
      "implementation_action": "build_new",
      "standard_path": "journeys/VCGF-UI-JRN-011-PublicSubmitTrackRespond.md",
      "review_compositions": [
        "VCGF-UI-SCR-018",
        "VCGF-UI-SCR-004"
      ],
      "review_components": [
        "VCGF-UI-COMP-003",
        "VCGF-UI-COMP-027",
        "VCGF-UI-COMP-029"
      ],
      "review_interactions": [
        "VCGF-UI-INT-001",
        "VCGF-UI-INT-006",
        "VCGF-UI-INT-016",
        "VCGF-UI-INT-024"
      ],
      "reason": "Explicit cross-screen journey signals matched; journey is independent of screen/component/interaction activation."
    }
  ],
  "external_standards": [],
  "compatibility_reviews": [],
  "interaction_reviews": [
    {
      "left": "VCGF-UI-INT-001",
      "right": "VCGF-UI-INT-006",
      "relation_type": "complementary",
      "severity": "info",
      "rule": "إنشاء السجل قد يستخدم آلة الحفظ/الإرسال، لكن لا يفعّلها إذا كان الإنشاء أمرًا واحدًا بسيطًا."
    }
  ],
  "composition_reviews": [],
  "journey_reviews": [],
  "standards_to_load": [
    "standards/VCGF-UI-COMP-003-SmartFormFields.md",
    "standards/VCGF-UI-COMP-008-UnifiedFeedbackSystem.md",
    "interactions/VCGF-UI-INT-001-SmartCreateFlow.md",
    "interactions/VCGF-UI-INT-005-UnsavedChangesProtection.md",
    "interactions/VCGF-UI-INT-006-SaveSubmitStateMachine.md",
    "screen-compositions/VCGF-UI-SCR-018-PublicSelfService.md",
    "screen-compositions/VCGF-UI-SCR-019-MobileFocusedTask.md",
    "journeys/VCGF-UI-JRN-011-PublicSubmitTrackRespond.md"
  ],
  "not_selected_component_count": 34,
  "not_selected_interaction_count": 21,
  "not_selected_screen_composition_count": 18,
  "not_selected_journey_count": 17,
  "composition_status": "selected",
  "journey_status": "selected",
  "orchestration": {
    "primary_composition_id": "VCGF-UI-SCR-018",
    "modifier_ids": [
      "VCGF-UI-SCR-019"
    ],
    "density_policy": "comfortable",
    "responsive_strategy": "mobile-primary-task",
    "mobile_transform": "task-preserving-reflow",
    "large_screen_transform": "context-expansion",
    "primary_action_limit": 1,
    "progressive_disclosure": true,
    "role_adaptation": "priority-only",
    "preserve_task_context": true
  },
  "experience_orchestration": {
    "entry_channel": "external-link",
    "completion_expectation": "detail",
    "context_continuity": "strict",
    "selected_journey_ids": [
      "VCGF-UI-JRN-011"
    ],
    "return_to_origin": "validate-then-return",
    "deep_link_policy": "authorize-and-prerequisite-check",
    "scope_change_policy": "invalidate-incompatible-context",
    "runtime_evidence_required": true,
    "cross_layer_auto_activation": false
  },
  "warnings": []
}
