{
  "schema_version": "1.0.0",
  "project_id": "people-app",
  "screen_id": "person-create",
  "selection_status": "selected",
  "catalog_component_count": 36,
  "interaction_pattern_count": 24,
  "screen_composition_count": 20,
  "journey_pattern_count": 18,
  "selected_components": [
    {
      "standard_id": "VCGF-UI-COMP-003",
      "decision": "required",
      "matched_signals": [
        "form_create_edit"
      ],
      "implementation_action": "reuse",
      "standard_path": "standards/VCGF-UI-COMP-003-SmartFormFields.md",
      "review_relationships": [
        "VCGF-UI-COMP-001",
        "VCGF-UI-COMP-008",
        "VCGF-UI-COMP-012"
      ],
      "reason": "Explicit component capability signals matched; relationships are review-only."
    }
  ],
  "selected_interactions": [
    {
      "standard_id": "VCGF-UI-INT-001",
      "decision": "required",
      "matched_signals": [
        "record_create"
      ],
      "implementation_action": "build_new",
      "standard_path": "interactions/VCGF-UI-INT-001-SmartCreateFlow.md",
      "review_components": [
        "VCGF-UI-COMP-003",
        "VCGF-UI-COMP-008",
        "VCGF-UI-COMP-012",
        "VCGF-UI-COMP-023"
      ],
      "reason": "Explicit interaction-state/risk signals matched; no cross-layer auto-activation."
    },
    {
      "standard_id": "VCGF-UI-INT-005",
      "decision": "required",
      "matched_signals": [
        "unsaved_changes"
      ],
      "implementation_action": "build_new",
      "standard_path": "interactions/VCGF-UI-INT-005-UnsavedChangesProtection.md",
      "review_components": [
        "VCGF-UI-COMP-003",
        "VCGF-UI-COMP-023",
        "VCGF-UI-COMP-009"
      ],
      "reason": "Explicit interaction-state/risk signals matched; no cross-layer auto-activation."
    },
    {
      "standard_id": "VCGF-UI-INT-006",
      "decision": "required",
      "matched_signals": [
        "save_submit"
      ],
      "implementation_action": "build_new",
      "standard_path": "interactions/VCGF-UI-INT-006-SaveSubmitStateMachine.md",
      "review_components": [
        "VCGF-UI-COMP-003",
        "VCGF-UI-COMP-011",
        "VCGF-UI-COMP-015",
        "VCGF-UI-COMP-023"
      ],
      "reason": "Explicit interaction-state/risk signals matched; no cross-layer auto-activation."
    },
    {
      "standard_id": "VCGF-UI-INT-019",
      "decision": "required",
      "matched_signals": [
        "duplicate_submit_risk"
      ],
      "implementation_action": "build_new",
      "standard_path": "interactions/VCGF-UI-INT-019-IdempotentSubmissionProtection.md",
      "review_components": [
        "VCGF-UI-COMP-003",
        "VCGF-UI-COMP-012",
        "VCGF-UI-COMP-008"
      ],
      "reason": "Explicit interaction-state/risk signals matched; no cross-layer auto-activation."
    }
  ],
  "selected_screen_compositions": [
    {
      "standard_id": "VCGF-UI-SCR-004",
      "kind": "primary",
      "decision": "required",
      "matched_signals": [
        "form_transaction"
      ],
      "implementation_action": "build_new",
      "standard_path": "screen-compositions/VCGF-UI-SCR-004-FormTransaction.md",
      "review_components": [
        "VCGF-UI-COMP-003",
        "VCGF-UI-COMP-008",
        "VCGF-UI-COMP-023"
      ],
      "review_interactions": [
        "VCGF-UI-INT-001",
        "VCGF-UI-INT-002",
        "VCGF-UI-INT-005",
        "VCGF-UI-INT-006",
        "VCGF-UI-INT-019"
      ],
      "reason": "Highest explicit composition evidence; other layers remain independent."
    }
  ],
  "selected_journeys": [
    {
      "standard_id": "VCGF-UI-JRN-002",
      "decision": "required",
      "matched_signals": [
        "create_to_detail"
      ],
      "implementation_action": "build_new",
      "standard_path": "journeys/VCGF-UI-JRN-002-CreateToDetailContinuation.md",
      "review_compositions": [
        "VCGF-UI-SCR-004",
        "VCGF-UI-SCR-003"
      ],
      "review_components": [
        "VCGF-UI-COMP-003",
        "VCGF-UI-COMP-025",
        "VCGF-UI-COMP-008"
      ],
      "review_interactions": [
        "VCGF-UI-INT-001",
        "VCGF-UI-INT-006",
        "VCGF-UI-INT-019",
        "VCGF-UI-INT-024"
      ],
      "reason": "Explicit cross-screen journey signals matched; journey is independent of screen/component/interaction activation."
    }
  ],
  "external_standards": [
    {
      "standard_id": "CALENDAR-GOVERNANCE-ADDENDUM",
      "decision": "required",
      "matched_signals": [
        "birth_date"
      ],
      "standard_path": "external-standards/CALENDAR-GOVERNANCE-ADDENDUM.md",
      "reason": "Explicit bound-standard signal matched."
    },
    {
      "standard_id": "UI-COMP-SEARCHABLE-SELECT",
      "decision": "required",
      "matched_signals": [
        "country_city_picker",
        "searchable_choice"
      ],
      "standard_path": "external-standards/ENTERPRISE-SEARCHABLE-SELECT-COMBOBOX.md",
      "reason": "Explicit bound-standard signal matched."
    }
  ],
  "compatibility_reviews": [],
  "interaction_reviews": [
    {
      "left": "VCGF-UI-INT-001",
      "right": "VCGF-UI-INT-006",
      "relation_type": "complementary",
      "severity": "info",
      "rule": "إنشاء السجل قد يستخدم آلة الحفظ/الإرسال، لكن لا يفعّلها إذا كان الإنشاء أمرًا واحدًا بسيطًا."
    },
    {
      "left": "VCGF-UI-INT-001",
      "right": "VCGF-UI-INT-019",
      "relation_type": "authority-boundary",
      "severity": "review",
      "rule": "إذا كان الإنشاء قابلًا لإعادة الإرسال فيجب أن يحسم الخادم idempotency؛ تعطيل الزر وحده لا يكفي."
    },
    {
      "left": "VCGF-UI-INT-006",
      "right": "VCGF-UI-INT-019",
      "relation_type": "authority-boundary",
      "severity": "review",
      "rule": "الإرسال النهائي المتكرر يحتاج معرف قصد ثابتًا إن كان الأثر غير idempotent."
    }
  ],
  "composition_reviews": [],
  "journey_reviews": [],
  "standards_to_load": [
    "standards/VCGF-UI-COMP-003-SmartFormFields.md",
    "interactions/VCGF-UI-INT-001-SmartCreateFlow.md",
    "interactions/VCGF-UI-INT-005-UnsavedChangesProtection.md",
    "interactions/VCGF-UI-INT-006-SaveSubmitStateMachine.md",
    "interactions/VCGF-UI-INT-019-IdempotentSubmissionProtection.md",
    "screen-compositions/VCGF-UI-SCR-004-FormTransaction.md",
    "journeys/VCGF-UI-JRN-002-CreateToDetailContinuation.md",
    "external-standards/CALENDAR-GOVERNANCE-ADDENDUM.md",
    "external-standards/ENTERPRISE-SEARCHABLE-SELECT-COMBOBOX.md"
  ],
  "not_selected_component_count": 35,
  "not_selected_interaction_count": 20,
  "not_selected_screen_composition_count": 19,
  "not_selected_journey_count": 17,
  "composition_status": "selected",
  "journey_status": "selected",
  "orchestration": {
    "primary_composition_id": "VCGF-UI-SCR-004",
    "modifier_ids": [],
    "density_policy": "comfortable",
    "responsive_strategy": "task-preserving-adaptive",
    "mobile_transform": "task-preserving-reflow",
    "large_screen_transform": "context-expansion",
    "primary_action_limit": 1,
    "progressive_disclosure": true,
    "role_adaptation": "priority-only",
    "preserve_task_context": true
  },
  "experience_orchestration": {
    "entry_channel": "internal-navigation",
    "completion_expectation": "detail",
    "context_continuity": "task-scoped",
    "selected_journey_ids": [
      "VCGF-UI-JRN-002"
    ],
    "return_to_origin": "validate-then-return",
    "deep_link_policy": "authorize-and-prerequisite-check",
    "scope_change_policy": "invalidate-incompatible-context",
    "runtime_evidence_required": true,
    "cross_layer_auto_activation": false
  },
  "warnings": []
}
